{
  "$schema": "https://json-schema.org/draft/2020-12/schema",
  "$id": "https://github.com/jonathan-vella/apex/schemas/session-state.schema.json",
  "title": "APEX Session State",
  "$defs": {
    "riskReference": {
      "type": "object",
      "additionalProperties": false,
      "required": ["path", "sha256"],
      "properties": {
        "path": { "type": "string", "minLength": 1 },
        "sha256": { "type": "string", "pattern": "^[a-f0-9]{64}$" },
        "id": { "type": "string", "minLength": 1 }
      }
    }
  },
  "description": "Shape of agent-output/{project}/00-session-state.json produced by the Orchestrator. Tracks workflow progress, decisions, and review audit. Enforced by scripts/validate-session-state.mjs.",
  "type": "object",
  "required": [
    "schema_version",
    "project",
    "iac_tool",
    "region",
    "branch",
    "updated",
    "current_step",
    "decisions",
    "open_findings",
    "steps"
  ],
  "additionalProperties": true,
  "allOf": [
    {
      "if": {
        "anyOf": [
          {
            "required": ["decisions"],
            "properties": {
              "decisions": {
                "required": ["plan_status"],
                "properties": { "plan_status": { "const": "EXCEPTION_AUTHORIZED" } }
              }
            }
          },
          {
            "required": ["decision_log"],
            "properties": {
              "decision_log": {
                "contains": {
                  "type": "object",
                  "required": ["choice"],
                  "properties": { "choice": { "const": "EXCEPTION_AUTHORIZED" } }
                }
              }
            }
          }
        ]
      },
      "then": { "required": ["risk_authorizations"], "properties": { "risk_authorizations": { "minProperties": 1 } } }
    }
  ],
  "properties": {
    "risk_authorizations": {
      "type": "object",
      "additionalProperties": false,
      "patternProperties": {
        "^(deployment-complete|teardown-complete)$": {
          "required": ["execution"],
          "properties": { "execution": { "allOf": [{ "$ref": "#/$defs/riskReference" }, { "required": ["id"] }] } }
        },
        "^(plan-complete|codegen|code-complete|deploy|deployment-complete|teardown-complete)$": {
          "type": "object",
          "additionalProperties": false,
          "required": ["schema_version", "authorization", "approval", "context"],
          "properties": {
            "schema_version": { "const": "risk-selection-v1" },
            "authorization": { "$ref": "#/$defs/riskReference" },
            "approval": { "$ref": "#/$defs/riskReference" },
            "execution": { "oneOf": [{ "type": "null" }, { "$ref": "#/$defs/riskReference" }] },
            "context": { "oneOf": [{ "type": "null" }, { "$ref": "#/$defs/riskReference" }] }
          }
        }
      }
    },
    "review_selections": {
      "type": "object",
      "additionalProperties": false,
      "patternProperties": {
        "^(3_5|4)$": {
          "type": "object",
          "additionalProperties": false,
          "required": [
            "schema_version",
            "path",
            "sha256",
            "pass_number",
            "review_focus",
            "input_coverage",
            "selected_at"
          ],
          "properties": {
            "schema_version": { "const": "review-selection-v1" },
            "path": { "type": "string", "minLength": 1 },
            "sha256": { "type": "string", "pattern": "^[a-f0-9]{64}$" },
            "pass_number": { "type": "integer", "minimum": 2 },
            "review_focus": { "enum": ["comprehensive", "governance-reconciliation"] },
            "input_coverage": { "const": "primary-and-review-guidance" },
            "selected_at": { "type": "string", "format": "date-time" }
          }
        }
      }
    },
    "schema_version": {
      "type": "string",
      "enum": ["1.0", "2.0", "3.0"],
      "description": "Schema version. New files must use 3.0."
    },
    "project": {
      "type": "string",
      "minLength": 1,
      "description": "Project folder name under agent-output/."
    },
    "iac_tool": {
      "type": "string",
      "enum": ["", "Bicep", "Terraform"],
      "description": "Selected Infrastructure as Code tool. Empty until decided."
    },
    "region": {
      "type": "string",
      "description": "Primary Azure region for deployment."
    },
    "branch": {
      "type": "string",
      "description": "Git branch associated with this session."
    },
    "updated": {
      "type": "string",
      "description": "ISO 8601 timestamp of last update."
    },
    "current_step": {
      "type": "integer",
      "minimum": 0,
      "maximum": 7,
      "description": "Current workflow step (0 = not started, 1-7 = active step)."
    },
    "decisions": {
      "type": "object",
      "required": ["region", "compliance", "budget", "architecture_pattern", "deployment_strategy"],
      "additionalProperties": true,
      "properties": {
        "workflow_contract": {
          "type": "string",
          "enum": ["", "practical-v1"],
          "description": "New-project default; legacy projects require explicit owner-approved adoption."
        },
        "material_inputs": {
          "type": "object",
          "description": "Authoritative scoped human choices; domain policy/pricing facts remain in their evidence artifacts.",
          "additionalProperties": {
            "type": "object",
            "required": ["input_id", "value", "environments", "owner", "request_id", "recorded_at"],
            "properties": {
              "input_id": { "type": "string", "minLength": 1 },
              "value": {},
              "environments": {
                "type": "array",
                "minItems": 1,
                "items": { "enum": ["dev", "test", "staging", "prod", "sandbox"] }
              },
              "owner": { "type": "string", "minLength": 1 },
              "request_id": { "type": "string", "minLength": 1 },
              "recorded_at": { "type": "string" }
            },
            "additionalProperties": false
          }
        },
        "phase_scopes": {
          "type": "object",
          "description": "Explicit consumed-input/environment scope; never Azure or deployment authorization."
        },
        "review_cycles": {
          "type": "object",
          "description": "Actual artifact/lens initial/closure accounting, preserving exhausted history."
        },
        "assessment_views": {
          "type": "object",
          "description": "Derived view bindings; completion rechecks current consumed inputs."
        },
        "region": { "type": "string" },
        "compliance": { "type": "string" },
        "budget": { "type": "string" },
        "architecture_pattern": { "type": "string" },
        "deployment_strategy": { "type": "string" },
        "complexity": {
          "type": "string",
          "enum": ["simple", "standard", "complex", ""],
          "description": "Project complexity tier. Empty until assessed."
        },
        "sku_manifest_status": {
          "type": "string",
          "enum": ["", "draft", "reviewed", "locked", "deploying", "deployed", "drift"],
          "description": "Lifecycle status of agent-output/{project}/sku-manifest.json. Empty until Step 1 creates rev 1."
        },
        "sku_manifest_revision": {
          "type": "integer",
          "minimum": 0,
          "description": "Highest revisions[].rev currently persisted in sku-manifest.json. 0 = not yet created."
        },
        "sku_overrides": {
          "type": "array",
          "description": "Append-only log of SKU substitutions resolved at Step 6 (Deploy) for quota/region/capacity conflicts. Array — not dynamic keys.",
          "items": {
            "type": "object",
            "required": ["id", "old_size", "new_size", "reason", "region", "env", "resolution"],
            "additionalProperties": false,
            "properties": {
              "id": { "type": "string", "description": "services[].id from sku-manifest.json." },
              "old_size": { "type": "string" },
              "new_size": { "type": "string" },
              "reason": { "type": "string", "minLength": 1 },
              "region": { "type": "string" },
              "env": {
                "type": "string",
                "enum": ["dev", "test", "stage", "prod"]
              },
              "resolution": {
                "type": "string",
                "enum": ["revert_to_plan", "accept_substitute", "change_region", "abort"]
              },
              "resolved_at": { "type": "string", "format": "date-time" },
              "manifest_revision": { "type": "integer", "minimum": 1 }
            }
          }
        },
        "sku_conflict_resolution": {
          "type": "string",
          "enum": ["", "revert_to_plan", "accept_substitute", "change_region", "abort"],
          "description": "Most recent Step 6 SKU conflict resolution (escalation enum). Empty when no active conflict."
        }
      }
    },
    "open_findings": {
      "type": "array",
      "items": { "type": "string" },
      "description": "Unresolved findings carried forward between steps."
    },
    "decision_log": {
      "type": "array",
      "items": {
        "type": "object",
        "properties": {
          "step": { "type": ["integer", "string"] },
          "decision": { "type": "string" },
          "rationale": { "type": "string" },
          "timestamp": { "type": "string" }
        }
      },
      "description": "Append-only log of key decisions made during the workflow."
    },
    "review_audit": {
      "type": "object",
      "description": "Per-step challenger review tracking.",
      "patternProperties": {
        "^step_[0-9_]+$": {
          "type": "object",
          "properties": {
            "complexity": { "type": "string" },
            "passes_planned": {
              "type": "integer",
              "minimum": 0
            },
            "passes_executed": {
              "type": "integer",
              "minimum": 0
            },
            "skipped": {
              "type": "array",
              "items": { "type": "string" }
            },
            "skip_reasons": {
              "type": "array",
              "items": { "type": "string" }
            },
            "models_used": {
              "type": "array",
              "items": { "type": "string" }
            }
          },
          "additionalProperties": true
        }
      },
      "additionalProperties": false
    },
    "steps": {
      "type": "object",
      "description": "Per-step execution state keyed by step number (1-7, 3_5).",
      "patternProperties": {
        "^[0-9_]+$": {
          "type": "object",
          "required": [
            "name",
            "agent",
            "status",
            "sub_step",
            "started",
            "completed",
            "artifacts",
            "context_files_used"
          ],
          "additionalProperties": true,
          "properties": {
            "name": {
              "type": "string",
              "enum": [
                "Requirements",
                "Architecture",
                "Design",
                "Governance",
                "IaC Plan",
                "IaC Code",
                "Deploy",
                "As-Built"
              ]
            },
            "agent": { "type": "string" },
            "status": {
              "type": "string",
              "enum": ["pending", "in_progress", "complete", "skipped", "stale"]
            },
            "sub_step": { "type": ["string", "null"] },
            "started": { "type": ["string", "null"] },
            "completed": { "type": ["string", "null"] },
            "artifacts": {
              "type": "array",
              "items": { "type": "string" }
            },
            "context_files_used": {
              "type": "array",
              "items": { "type": "string" }
            },
            "telemetry": {
              "type": "object",
              "description": "Wave-0 telemetry merged in via `apex-recall checkpoint --telemetry-*` flags. Consumed by tools/scripts/measure-workflow-baseline.mjs to produce per-tier averages so subsequent waves' savings claims are falsifiable.",
              "additionalProperties": false,
              "properties": {
                "step_start_iso": { "type": "string", "format": "date-time" },
                "step_end_iso": { "type": "string", "format": "date-time" },
                "elapsed_ms": { "type": "integer", "minimum": 0 },
                "input_tokens": { "type": "integer", "minimum": 0 },
                "output_tokens": { "type": "integer", "minimum": 0 },
                "subagent_count": { "type": "integer", "minimum": 0 },
                "validation_attempts": { "type": "integer", "minimum": 0 },
                "cache_hits": { "type": "integer", "minimum": 0 }
              }
            }
          }
        }
      },
      "additionalProperties": false
    }
  }
}
