{
  "schema_version": "1.0",
  "project": "contoso-service-hub-run-2",
  "iac_tool": "Bicep",
  "region": "swedencentral",
  "branch": "feat/azure-skills-integration",
  "updated": "2026-03-16T15:10:00Z",
  "current_step": 1,
  "decisions": {
    "region": "swedencentral",
    "compliance": "GDPR",
    "budget": "~€8,000-12,000/month (estimated)",
    "architecture_pattern": "N-Tier / Microservices",
    "deployment_strategy": "",
    "complexity": "complex"
  },
  "open_findings": [
    "GAP-01: No explicit budget in RFQ — estimated from Table 2 volumetrics",
    "GAP-02: 128 GB Redis tier selection — Premium P4 vs Enterprise vs Azure Managed Redis",
    "GAP-03: Container Engine ambiguity — AKS vs Azure Container Apps"
  ],
  "decision_log": [
    {
      "id": "D001",
      "step": 1,
      "agent": "02-Requirements",
      "title": "IaC tool selection",
      "choice": "Bicep",
      "rationale": "Specified in project configuration; native Azure IaC with first-class AVM support",
      "status": "confirmed",
      "timestamp": "2026-03-16T15:01:00Z"
    },
    {
      "id": "D002",
      "step": 1,
      "agent": "02-Requirements",
      "title": "128 GB Redis tier selection",
      "choice": "Deferred to Architecture (Step 2)",
      "rationale": "RFQ specifies 128 GB in-memory cache. Azure Cache for Redis Premium P4 provides ~120 GB usable. Enterprise E100 provides 100 GB. Azure Managed Redis may offer 128 GB+. Architect must evaluate actual capacity needs vs. cost.",
      "status": "pending",
      "timestamp": "2026-03-16T15:05:00Z"
    },
    {
      "id": "D003",
      "step": 1,
      "agent": "02-Requirements",
      "title": "AKS vs Azure Container Apps",
      "choice": "Deferred to Architecture (Step 2)",
      "rationale": "RFQ lists both 'Container Engine' (Table 2 #5) and 'Managed Kubernetes' (Section 4.1 scope). AKS provides full Kubernetes control; Container Apps provides simpler serverless containers. Decision depends on team expertise and operational maturity.",
      "status": "pending",
      "timestamp": "2026-03-16T15:05:00Z"
    },
    {
      "id": "D004",
      "step": 1,
      "agent": "02-Requirements",
      "title": "CIAM provider: Entra External ID",
      "choice": "Microsoft Entra External ID",
      "rationale": "Azure AD B2C unavailable for new customers since May 2025. Entra External ID is the current Microsoft CIAM solution for greenfield projects in 2026.",
      "status": "confirmed",
      "timestamp": "2026-03-16T15:03:00Z"
    },
    {
      "id": "D005",
      "step": 1,
      "agent": "02-Requirements",
      "title": "Primary Azure region",
      "choice": "swedencentral",
      "rationale": "EU GDPR-compliant region; low latency to Northern/Central Europe user base; aligns with project defaults",
      "status": "confirmed",
      "timestamp": "2026-03-16T15:03:00Z"
    },
    {
      "id": "D006",
      "step": 1,
      "agent": "02-Requirements",
      "title": "Budget estimate",
      "choice": "~€8,000-12,000/month across 3 environments",
      "rationale": "No budget stated in RFQ. Estimated from 15 cloud services and Table 2 volumetrics. 128 GB Redis is the largest cost driver (~€2,000-4,000/mo). Must be validated with Azure Pricing MCP in Step 2.",
      "status": "pending",
      "timestamp": "2026-03-16T15:06:00Z"
    },
    {
      "id": "D007",
      "step": 1,
      "agent": "02-Requirements",
      "title": "Complexity classification",
      "choice": "complex",
      "rationale": "15 distinct cloud services (>8 threshold), 3 environments, GDPR mandatory compliance with clause-by-clause data residency, 40× transaction growth trajectory",
      "status": "confirmed",
      "timestamp": "2026-03-16T15:08:00Z"
    },
    {
      "id": "D008",
      "step": 1,
      "agent": "02-Requirements",
      "title": "Multi-region DR excluded",
      "choice": "Single-region deployment (no DR)",
      "rationale": "RFQ Section 4.1 explicitly states: 'Disaster recovery across multiple regions is not included in the current RFQ scope.'",
      "status": "confirmed",
      "timestamp": "2026-03-16T15:04:00Z"
    }
  ],
  "review_audit": {
    "step_1": {
      "complexity": "complex",
      "passes_planned": 1,
      "passes_executed": 0,
      "skipped": ["challenger-review"],
      "skip_reasons": [
        "Automated E2E evaluation — challenger review skipped per test protocol"
      ],
      "models_used": ["claude-opus-4-6"]
    },
    "step_2": {
      "complexity": "complex",
      "passes_planned": 0,
      "passes_executed": 0,
      "skipped": [],
      "skip_reasons": [],
      "models_used": []
    },
    "step_3.5": {
      "complexity": "complex",
      "passes_planned": 1,
      "passes_executed": 0,
      "skipped": [],
      "skip_reasons": [],
      "models_used": []
    },
    "step_4": {
      "complexity": "complex",
      "passes_planned": 0,
      "passes_executed": 0,
      "skipped": [],
      "skip_reasons": [],
      "models_used": []
    },
    "step_5": {
      "complexity": "complex",
      "passes_planned": 0,
      "passes_executed": 0,
      "skipped": [],
      "skip_reasons": [],
      "models_used": []
    },
    "step_6": {
      "complexity": "complex",
      "passes_planned": 0,
      "passes_executed": 0,
      "skipped": [],
      "skip_reasons": [],
      "models_used": []
    }
  },
  "steps": {
    "1": {
      "name": "Requirements",
      "agent": "02-Requirements",
      "status": "complete",
      "sub_step": "phase_5_artifact",
      "started": "2026-03-16T15:01:00Z",
      "completed": "2026-03-16T15:10:00Z",
      "artifacts": [
        "agent-output/contoso-service-hub-run-2/01-requirements.md",
        "agent-output/contoso-service-hub-run-2/README.md"
      ],
      "context_files_used": ["tmp/00-rfp.md"]
    },
    "2": {
      "name": "Architecture",
      "agent": "03-Architect",
      "status": "pending",
      "sub_step": null,
      "started": null,
      "completed": null,
      "artifacts": [],
      "context_files_used": []
    },
    "3": {
      "name": "Design",
      "agent": "04-Design",
      "status": "pending",
      "sub_step": null,
      "started": null,
      "completed": null,
      "artifacts": [],
      "context_files_used": []
    },
    "3.5": {
      "name": "Governance",
      "agent": "04g-Governance",
      "status": "pending",
      "sub_step": null,
      "started": null,
      "completed": null,
      "artifacts": [],
      "context_files_used": []
    },
    "4": {
      "name": "IaC Plan",
      "agent": "05b-Bicep Planner",
      "status": "pending",
      "sub_step": null,
      "started": null,
      "completed": null,
      "artifacts": [],
      "context_files_used": []
    },
    "5": {
      "name": "IaC Code",
      "agent": "06b-Bicep CodeGen",
      "status": "pending",
      "sub_step": null,
      "started": null,
      "completed": null,
      "artifacts": [],
      "context_files_used": []
    },
    "6": {
      "name": "Deploy",
      "agent": "07b-Bicep Deploy",
      "status": "pending",
      "sub_step": null,
      "started": null,
      "completed": null,
      "artifacts": [],
      "context_files_used": []
    },
    "7": {
      "name": "As-Built",
      "agent": "08-As-Built",
      "status": "pending",
      "sub_step": null,
      "started": null,
      "completed": null,
      "artifacts": [],
      "context_files_used": []
    }
  }
}
