{
  "schema_version": "3.0",
  "project": "g6-hyperscale-platform",
  "iac_tool": "",
  "region": "swedencentral",
  "branch": "main",
  "updated": "2026-05-06T09:16:03Z",
  "current_step": 0,
  "decisions": {
    "region": "swedencentral",
    "compliance": "",
    "budget": "",
    "architecture_pattern": "",
    "deployment_strategy": "",
    "complexity": ""
  },
  "open_findings": [],
  "decision_log": [
    {
      "decision": "Decomposed 3-page diagram: Overview + SWC detail + GWC detail",
      "timestamp": "2026-05-06T09:16:03Z",
      "rationale": "Per-page cell counts under 30; region zones use colored groups; global resources in horizontal band at top",
      "step": "3"
    }
  ],
  "review_audit": {
    "step_1": {
      "complexity": "",
      "passes_planned": 0,
      "passes_executed": 0,
      "skipped": [],
      "skip_reasons": [],
      "models_used": []
    },
    "step_2": {
      "complexity": "",
      "passes_planned": 0,
      "passes_executed": 0,
      "skipped": [],
      "skip_reasons": [],
      "models_used": []
    },
    "step_3_5": {
      "complexity": "",
      "passes_planned": 0,
      "passes_executed": 0,
      "skipped": [],
      "skip_reasons": [],
      "models_used": []
    },
    "step_4": {
      "complexity": "",
      "passes_planned": 0,
      "passes_executed": 0,
      "skipped": [],
      "skip_reasons": [],
      "models_used": []
    },
    "step_5": {
      "complexity": "",
      "passes_planned": 0,
      "passes_executed": 0,
      "skipped": [],
      "skip_reasons": [],
      "models_used": []
    },
    "step_6": {
      "complexity": "",
      "passes_planned": 0,
      "passes_executed": 0,
      "skipped": [],
      "skip_reasons": [],
      "models_used": []
    }
  },
  "steps": {
    "1": {
      "name": "Requirements",
      "agent": "02-Requirements",
      "status": "pending",
      "sub_step": null,
      "started": null,
      "completed": null,
      "artifacts": [],
      "context_files_used": []
    },
    "2": {
      "name": "Architecture",
      "agent": "03-Architect",
      "status": "pending",
      "sub_step": null,
      "started": null,
      "completed": null,
      "artifacts": [],
      "context_files_used": []
    },
    "3": {
      "name": "Design",
      "agent": "04-Design",
      "status": "complete",
      "sub_step": null,
      "started": null,
      "completed": "2026-05-06T09:16:03Z",
      "artifacts": [],
      "context_files_used": []
    },
    "3_5": {
      "name": "Governance",
      "agent": "04g-Governance",
      "status": "pending",
      "sub_step": null,
      "started": null,
      "completed": null,
      "artifacts": [],
      "context_files_used": []
    },
    "4": {
      "name": "IaC Plan",
      "agent": "",
      "status": "pending",
      "sub_step": null,
      "started": null,
      "completed": null,
      "artifacts": [],
      "context_files_used": []
    },
    "5": {
      "name": "IaC Code",
      "agent": "",
      "status": "pending",
      "sub_step": null,
      "started": null,
      "completed": null,
      "artifacts": [],
      "context_files_used": []
    },
    "6": {
      "name": "Deploy",
      "agent": "",
      "status": "pending",
      "sub_step": null,
      "started": null,
      "completed": null,
      "artifacts": [],
      "context_files_used": []
    },
    "7": {
      "name": "As-Built",
      "agent": "08-As-Built",
      "status": "pending",
      "sub_step": null,
      "started": null,
      "completed": null,
      "artifacts": [],
      "context_files_used": []
    }
  }
}
