{
  "schema_version": "3.0",
  "project": "drawio-quality-uplift",
  "iac_tool": "",
  "region": "swedencentral",
  "branch": "main",
  "updated": "2026-05-05T16:16:31Z",
  "current_step": 0,
  "decisions": {
    "region": "swedencentral",
    "compliance": "",
    "budget": "",
    "architecture_pattern": "",
    "deployment_strategy": "",
    "complexity": ""
  },
  "open_findings": [
    "G1 (three-tier-web) baseline captured: retries=0, friction_count=3, rubric_mean=2.86/4. 5 quality issues recorded including SqlHTTPS edge-label collision and missing Managed Identity edges. Source: Copilot Chat session 50996f96-3b0e-4056-a15d-df67ceba7fe5."
  ],
  "decision_log": [
    {
      "decision": "Backward compatibility waived (D-BC) — uplift may freely re-render existing .drawio files; WS-SHARED-COMPAT and tasks T-013/T-014 removed.",
      "timestamp": "2026-05-05T16:16:30Z",
      "rationale": "User gate decision post-Phase-1."
    },
    {
      "decision": "OQ-1 resolved: diagram-type dispatch lives in 04-Design agent (T-015 + T-016), not a new MCP tool.",
      "timestamp": "2026-05-05T16:16:30Z",
      "rationale": "Workflow-state-driven; keeps MCP server portable."
    },
    {
      "decision": "OQ-2 resolved: generate-legend (T-028) positions legend relative to diagram bounds with optional fixed x/y override.",
      "timestamp": "2026-05-05T16:16:30Z",
      "rationale": "Sensible default + escape hatch."
    },
    {
      "decision": "OQ-3 resolved: overlap validator (T-006) false-positive ceiling fixed at <=5%.",
      "timestamp": "2026-05-05T16:16:30Z",
      "rationale": "Matches existing palette-check tolerance pattern."
    },
    {
      "decision": "Adopted Option C for T-012: capture both retries (strict rule) AND friction_count (broader signal); composite cost = retries + friction is the divisor for scoreRegenerationRate.",
      "timestamp": "2026-05-05T16:16:31Z",
      "rationale": "Strict rule alone produced retries=0 on G1 but trace showed 3 friction events; cost composite avoids degenerate baseline."
    }
  ],
  "review_audit": {
    "step_1": {
      "complexity": "",
      "passes_planned": 0,
      "passes_executed": 0,
      "skipped": [],
      "skip_reasons": [],
      "models_used": []
    },
    "step_2": {
      "complexity": "",
      "passes_planned": 0,
      "passes_executed": 0,
      "skipped": [],
      "skip_reasons": [],
      "models_used": []
    },
    "step_3_5": {
      "complexity": "",
      "passes_planned": 0,
      "passes_executed": 0,
      "skipped": [],
      "skip_reasons": [],
      "models_used": []
    },
    "step_4": {
      "complexity": "",
      "passes_planned": 0,
      "passes_executed": 0,
      "skipped": [],
      "skip_reasons": [],
      "models_used": []
    },
    "step_5": {
      "complexity": "",
      "passes_planned": 0,
      "passes_executed": 0,
      "skipped": [],
      "skip_reasons": [],
      "models_used": []
    },
    "step_6": {
      "complexity": "",
      "passes_planned": 0,
      "passes_executed": 0,
      "skipped": [],
      "skip_reasons": [],
      "models_used": []
    }
  },
  "steps": {
    "1": {
      "name": "Requirements",
      "agent": "02-Requirements",
      "status": "pending",
      "sub_step": null,
      "started": null,
      "completed": null,
      "artifacts": [],
      "context_files_used": []
    },
    "2": {
      "name": "Architecture",
      "agent": "03-Architect",
      "status": "pending",
      "sub_step": null,
      "started": null,
      "completed": null,
      "artifacts": [],
      "context_files_used": []
    },
    "3": {
      "name": "Design",
      "agent": "04-Design",
      "status": "pending",
      "sub_step": null,
      "started": null,
      "completed": null,
      "artifacts": [],
      "context_files_used": []
    },
    "3_5": {
      "name": "Governance",
      "agent": "04g-Governance",
      "status": "pending",
      "sub_step": null,
      "started": null,
      "completed": null,
      "artifacts": [],
      "context_files_used": []
    },
    "4": {
      "name": "IaC Plan",
      "agent": "",
      "status": "pending",
      "sub_step": null,
      "started": null,
      "completed": null,
      "artifacts": [],
      "context_files_used": []
    },
    "5": {
      "name": "IaC Code",
      "agent": "",
      "status": "pending",
      "sub_step": null,
      "started": null,
      "completed": null,
      "artifacts": [],
      "context_files_used": []
    },
    "6": {
      "name": "Deploy",
      "agent": "",
      "status": "pending",
      "sub_step": null,
      "started": null,
      "completed": null,
      "artifacts": [],
      "context_files_used": []
    },
    "7": {
      "name": "As-Built",
      "agent": "08-As-Built",
      "status": "pending",
      "sub_step": null,
      "started": null,
      "completed": null,
      "artifacts": [],
      "context_files_used": []
    }
  }
}
