{
  "schema_version": "1.0",
  "project": "nordic-fresh-foods",
  "iac_tool": "Bicep",
  "region": "swedencentral",
  "branch": "chore/remove-microsoft-learn-mcp",
  "updated": "2026-03-11T16:00:00Z",
  "current_step": 5,
  "decisions": {
    "region": "swedencentral",
    "compliance": "GDPR,PCI-DSS",
    "budget": "<EUR1000/month",
    "architecture_pattern": "N-Tier Web Application, Cost-Optimized",
    "deployment_strategy": "phased-5-phase-standard",
    "complexity": "standard"
  },
  "open_findings": [],
  "review_audit": {
    "step_1": {
      "complexity": "standard",
      "passes_planned": 1,
      "passes_executed": 2,
      "skipped": [],
      "skip_reasons": [],
      "models_used": []
    },
    "step_2": {
      "complexity": "standard",
      "passes_planned": 2,
      "passes_executed": 4,
      "skipped": [],
      "skip_reasons": [],
      "models_used": [
        "GPT-5.4 (pass 1, security-governance)",
        "GPT-5.3-Codex (pass 2, architecture-reliability)",
        "GPT-5.3-Codex (pass 3, cost-feasibility)",
        "GPT-5.4 (cost-estimate comprehensive)"
      ]
    },
    "step_4": {
      "complexity": "standard",
      "passes_planned": 4,
      "passes_executed": 6,
      "skipped": [],
      "skip_reasons": [],
      "models_used": [
        "GPT-5.4 (governance comprehensive)",
        "GPT-5.4 (pass 1, security-governance)",
        "GPT-5.3-Codex (pass 2, architecture-reliability)",
        "GPT-5.3-Codex (pass 3, cost-feasibility)",
        "GPT-5.4 (revalidation, plan security-governance)",
        "GPT-5.4 (revalidation, governance comprehensive)"
      ]
    },
    "step_5": {
      "complexity": "standard",
      "passes_planned": 3,
      "passes_executed": 2,
      "skipped": ["pass_3"],
      "skip_reasons": ["Conditional: pass 2 (review subagent) had 0 must_fix after remediation"],
      "models_used": [
        "bicep-lint-subagent (syntax validation)",
        "bicep-review-subagent (AVM/standards review)"
      ]
    },
    "step_6": {
      "complexity": "",
      "passes_planned": 0,
      "passes_executed": 0,
      "skipped": [],
      "skip_reasons": [],
      "models_used": []
    }
  },
  "steps": {
    "1": {
      "name": "Requirements",
      "agent": "02-Requirements",
      "status": "complete",
      "sub_step": "phase_5_artifact",
      "started": "2026-03-11T10:19:27Z",
      "completed": "2026-03-11T10:30:00Z",
      "artifacts": [
        "01-requirements.md",
        "README.md",
        "challenge-findings-requirements.json"
      ],
      "context_files_used": []
    },
    "2": {
      "name": "Architecture",
      "agent": "03-Architect",
      "status": "complete",
      "sub_step": "phase_5_artifact",
      "started": "2026-03-11T11:00:00Z",
      "completed": "2026-03-11T12:45:00Z",
      "artifacts": [
        "02-architecture-assessment.md",
        "03-des-cost-estimate.md",
        "02-waf-scores.py",
        "02-waf-scores.png",
        "03-des-cost-distribution.py",
        "03-des-cost-distribution.png",
        "03-des-cost-projection.py",
        "03-des-cost-projection.png",
        "challenge-findings-architecture-pass1.json",
        "challenge-findings-architecture-pass2.json",
        "challenge-findings-architecture-pass3.json",
        "challenge-findings-cost-estimate.json"
      ],
      "context_files_used": ["01-requirements.md"]
    },
    "3": {
      "name": "Design",
      "agent": "04-Design",
      "status": "in_progress",
      "sub_step": "phase_3_adr",
      "started": "2026-03-11T12:12:16Z",
      "completed": null,
      "artifacts": [
        "03-des-diagram.py",
        "03-des-diagram.png",
        "03-des-adr-0001-cost-optimized-n-tier-azure-architecture.md"
      ],
      "context_files_used": [
        "02-architecture-assessment.md"
      ]
    },
    "4": {
      "name": "IaC Plan",
      "agent": "05b-Bicep Planner",
      "status": "complete",
      "sub_step": "phase_6_artifact",
      "started": "2026-03-11T13:00:00Z",
      "completed": "2026-03-11T15:30:00Z",
      "artifacts": [
        "04-governance-constraints.md",
        "04-governance-constraints.json",
        "04-implementation-plan.md",
        "04-dependency-diagram.py",
        "04-dependency-diagram.png",
        "04-runtime-diagram.py",
        "04-runtime-diagram.png",
        "challenge-findings-governance-constraints-pass1.json",
        "challenge-findings-plan-pass1.json",
        "challenge-findings-plan-pass2.json",
        "challenge-findings-plan-pass3.json",
        "challenge-findings-plan-revalidation.json",
        "challenge-findings-governance-revalidation.json"
      ],
      "context_files_used": [
        "02-architecture-assessment.md",
        "01-requirements.md"
      ]
    },
    "5": {
      "name": "IaC Code",
      "agent": "06b-Bicep CodeGen",
      "status": "complete",
      "sub_step": "phase_6_artifact",
      "started": "2026-03-11T16:00:00Z",
      "completed": "2025-07-13T12:00:00Z",
      "artifacts": [
        "04-preflight-check.md",
        "05-implementation-reference.md"
      ],
      "context_files_used": ["04-implementation-plan.md", "04-governance-constraints.json", "02-architecture-assessment.md"]
    },
    "6": {
      "name": "Deploy",
      "agent": "07b-Bicep Deploy",
      "status": "in_progress",
      "sub_step": "phase_2_preview",
      "started": "2026-03-11T17:00:00Z",
      "completed": null,
      "artifacts": [],
      "context_files_used": ["05-implementation-reference.md", "04-implementation-plan.md"]
    },
    "7": {
      "name": "As-Built",
      "agent": "08-As-Built",
      "status": "pending",
      "sub_step": null,
      "started": null,
      "completed": null,
      "artifacts": [],
      "context_files_used": []
    }
  }
}
